,name,rating,reviews,lat,lng,address,types,neighbourhood,density,income,district_x,district_y,hotel_count
0,El Nacional Barcelona,4.4,37535.0,41.390583,2.1683914,"Pg. de Gràcia, 24 Bis, L'Eixample, 08007 Barcelona, Spain","spanish_restaurant, restaurant, point_of_interest, food, establishment",el raval,429,11045.714285714286,ciutat vella,ciutat vella,50
1,Cerveceria Catalana,4.4,22330.0,41.3923251,2.1608515,"Carrer de Mallorca, 236, L'Eixample, 08008 Barcelona, Spain","spanish_restaurant, bar, restaurant, point_of_interest, food, establishment",el barri gòtic,268,14032.444444444443,ciutat vella,ciutat vella,59
2,Vinitus,4.5,15137.0,41.3900261,2.1640484,"Carrer del Consell de Cent, 333, L'Eixample, 08007 Barcelona, Spain","mediterranean_restaurant, bar, restaurant, point_of_interest, food, establishment",la barceloneta,124,14063.454545454546,ciutat vella,ciutat vella,5
3,Ciutat Comtal,4.4,20562.0,41.3888535,2.1667706,"Rambla de Catalunya, 18, Eixample, 08007 Barcelona, Spain","spanish_restaurant, bar, restaurant, point_of_interest, food, establishment","sant pere, santa caterina i la ribera",199,15395.615384615385,ciutat vella,ciutat vella,23
4,La Flauta | Aribau,4.5,11859.0,41.3868596,2.1610638,"Carrer d'Aribau, 23, L'Eixample, 08011 Barcelona, Spain","mediterranean_restaurant, spanish_restaurant, restaurant, point_of_interest, food, establishment",el fort pienc,336,19193.3,l'eixample,eixample,10
5,Honest Greens Plaça Catalunya,4.5,10272.0,41.3876946,2.1680496,"Rambla de Catalunya, 3, Eixample, 08007 Barcelona, Spain","mediterranean_restaurant, fast_food_restaurant, vegan_restaurant, vegetarian_restaurant, restaurant, point_of_interest, food, establishment",la sagrada família,493,18661.08823529412,l'eixample,eixample,4
6,Colom Restaurant,4.7,26749.0,41.3798528,2.1765,"Carrer dels Escudellers, 33, Ciutat Vella, 08002 Barcelona, Spain","mediterranean_restaurant, spanish_restaurant, seafood_restaurant, restaurant, point_of_interest, food, establishment",la dreta de l'eixample,211,23913.241379310344,l'eixample,eixample,94
7,Paradiso,4.3,6625.0,41.3836774,2.1836913,"Carrer de Rera Palau, 4, Ciutat Vella, 08003 Barcelona, Spain","bar, sandwich_shop, restaurant, point_of_interest, food, establishment",l'antiga esquerra de l'eixample,342,22555.19230769231,l'eixample,eixample,28
8,Hard Rock Cafè,4.4,24903.0,41.3858942,2.1707583,"Pl. de Catalunya, 21, Ciutat Vella, 08002 Barcelona, Spain","american_restaurant, hamburger_restaurant, event_venue, bar, restaurant, point_of_interest, food, establishment",la nova esquerra de l'eixample,426,20893.1,l'eixample,eixample,16
9,Cañete,4.6,7019.0,41.37915280000001,2.173125,"Carrer de la Unió, 17, Ciutat Vella, 08001 Barcelona, Spain","restaurant, spanish_restaurant, bar, point_of_interest, food, establishment",sant antoni,473,18695.666666666668,l'eixample,eixample,14
10,La Pepita,4.5,6813.0,41.3979631,2.1610472,"Carrer de Còrsega, 343, Gràcia, 08037 Barcelona, Spain","restaurant, food, point_of_interest, establishment",la marina del prat vermell,1,12529.0,sants-montjuic,sants-montjuïc,1
11,La Selva Barcelona | Còrsega,4.7,9862.0,41.3922131,2.1532164,"Carrer de Còrsega, 235, L'Eixample, 08036 Barcelona, Spain","restaurant, food, point_of_interest, establishment",la font de la guatlla,339,17320.14285714286,sants-montjuic,sants-montjuïc,2
12,McDonald's | Passeig de Gràcia,3.8,6801.0,41.3919,2.16582,"Pg. de Gràcia, 48, L'Eixample, 08007 Barcelona, Spain","fast_food_restaurant, restaurant, point_of_interest, food, establishment",hostafrancs,386,16617.1,sants-montjuic,sants-montjuïc,7
13,Billy Brunch,4.8,8462.0,41.3977203,2.1693751,"Carrer de Bailèn, 115, L'Eixample, 08009 Barcelona, Spain","breakfast_restaurant, brunch_restaurant, restaurant, point_of_interest, food, establishment",sants,394,18093.344827586207,sants-montjuic,sants-montjuïc,4
14,"Mandarin Oriental, Barcelona",4.6,3506.0,41.3911676,2.1665773,"Pg. de Gràcia, 38-40, L'Eixample, 08007 Barcelona, Spain","hotel, banquet_hall, wedding_venue, mediterranean_restaurant, catering_service, food_delivery, spa, event_venue, lodging, restaurant, point_of_interest, food, establishment",les corts,322,23420.28571428572,les corts,les corts,11
15,Sartoria Panatieri,4.3,4280.0,41.39717460000001,2.1649178,"Carrer de Provença, 330, L'Eixample, 08037 Barcelona, Spain","pizza_restaurant, meal_delivery, food_delivery, food_store, meal_takeaway, restaurant, food, point_of_interest, store, establishment",la maternitat i sant ramon,123,20916.733333333337,les corts,les corts,6
16,La Flauta | Rambla de Catalunya,4.5,3259.0,41.3928668,2.1607347,"Rambla de Catalunya, 91, Eixample, 08008 Barcelona, Spain","restaurant, food, point_of_interest, establishment",pedralbes,43,30790.0,les corts,les corts,3
17,Botafumeiro,4.4,8334.0,41.4004237,2.1546386,"Carrer Gran de Gràcia, 81, Gràcia, 08012 Barcelona, Spain","seafood_restaurant, spanish_restaurant, restaurant, food, point_of_interest, establishment",sarrià,80,28640.875,sarrià-sant gervasi,sarrià-sant gervasi,4
18,Guanabara,4.3,7170.0,41.3954748,2.1710722,"Carrer del Consell de Cent, 403, L'Eixample, 08009 Barcelona, Spain","brazilian_restaurant, restaurant, food, point_of_interest, establishment",les tres torres,206,33338.545454545456,sarrià-sant gervasi,sarrià-sant gervasi,3
19,Parking Pizza | Passeig Sant Joan,4.4,7224.0,41.396311,2.1741057,"Pg. de St. Joan, 56, L'Eixample, 08009 Barcelona, Spain","pizza_restaurant, italian_restaurant, restaurant, food, point_of_interest, establishment",el putxet i el farró,349,23638.736842105263,sarrià-sant gervasi,sarrià-sant gervasi,6
20,Alice Secret Garden,3.9,4626.0,41.3902786,2.1708714,"Carrer de Pau Claris, 90, L'Eixample, 08010 Barcelona, Spain","brunch_restaurant, cafeteria, bar, restaurant, point_of_interest, food, establishment",vallcarca i els penitents,129,21755.545454545456,gràcia,gràcia,1
21,CASA SEAT,4.3,3776.0,41.3966338,2.1585626,"Pg. de Gràcia, 109, Gràcia, 08008 Barcelona, Spain","cultural_landmark, cultural_center, restaurant, food, car_dealer, point_of_interest, store, establishment",el coll,215,16869.4,gràcia,gràcia,1
22,Opium Barcelona Restaurant and Club,3.6,7845.0,41.3853365,2.1967534,"Pg. Marítim de la Barceloneta, 34, Ciutat Vella, 08003 Barcelona, Spain","night_club, bar, restaurant, point_of_interest, food, establishment",la salut,205,20674.4,gràcia,gràcia,1
23,Pacha Barcelona,3.2,8552.0,41.3857442,2.1970635,"Carrer de Ramon Trias Fargas, 2, Ciutat Vella, 08005 Barcelona, Spain","night_club, bar, restaurant, point_of_interest, food, establishment",la vila de gràcia,375,19559.666666666668,gràcia,gràcia,4
24,L'Ovella Negra | Marina,4.2,9082.0,41.3958581,2.1902418,"Carrer de Zamora, 78, Sant Martí, 08018 Barcelona, Spain","bar_and_grill, bar, restaurant, food, point_of_interest, establishment",el camp d'en grassot i gràcia nova,537,20501.48,gràcia,gràcia,2
25,Maná 75,4.4,6599.0,41.368862,2.1882694,"Pg. de Joan de Borbó, 101, Ciutat Vella, 08039 Barcelona, Spain","mediterranean_restaurant, meal_delivery, food_delivery, spanish_restaurant, seafood_restaurant, event_venue, korean_restaurant, restaurant, point_of_interest, food, establishment",el baix guinardó,455,17954.63157894737,gràcia,horta-guinardó,4
26,Arenas de Barcelona,4.2,66317.0,41.3763031,2.1493855,"Gran Via de les Corts Catalanes, 385, L'Eixample, 08015 Barcelona, Spain","shopping_mall, movie_theater, meal_takeaway, amusement_center, spanish_restaurant, supermarket, clothing_store, jewelry_store, grocery_store, food_store, restaurant, point_of_interest, food, store, establishment",el guinardó,282,17264.48,horta-guinardo,horta-guinardó,2
27,McDonald's,3.6,3399.0,41.405,2.19089,"Avenida Diagonal, 188 Centro Comercial, Les Glories, Local 201, Sant Martí, 08018 Barcelona, Spain","fast_food_restaurant, restaurant, food, point_of_interest, establishment",la vall d'hebron,79,18666.5,horta-guinardo,horta-guinardó,1
28,Sallès Hotel Pere IV,4.0,2478.0,41.3969121,2.1923528,"Carrer de Pallars, 128, Sant Martí, 08018 Barcelona, Spain","hotel, mediterranean_restaurant, massage, bar, sports_complex, gym, sports_activity_location, lodging, spa, health, restaurant, food, point_of_interest, establishment",horta,90,17006.809523809523,horta-guinardo,horta-guinardó,1
29,Hotel Best 4 Barcelona,4.0,1802.0,41.3960002,2.2008581,"Carrer del Doctor Trueta, 164, Sant Martí, 08005 Barcelona, Spain","hotel, parking, bar, lodging, restaurant, food, point_of_interest, establishment",porta,328,14412.666666666666,nou barris,nou barris,1
